{
  "protocol": "INTRANEL/1",
  "origin": "vera:primary",
  "actor": "vera:primary",
  "target": "vera:lane/bv",
  "reply_to": "bus:vera-v2",
  "message_id": "vec-exec-001",
  "operation_id": "exec-op-001",
  "target_operation_id": null,
  "parent_message_id": null,
  "conversation_id": "vec-conv-002",
  "performative": "EXECUTE",
  "subject": "repo:intranel/branch/work",
  "exact_subject": "sha1:89abcdef0123456789abcdef0123456789abcdef",
  "payload": {"action": "append", "path": "messages/example.md"},
  "authority_claim_ref": "auth:patrick/intranel-build",
  "constraints": ["non-force", "verify-readback"],
  "prohibited_effects": ["MERGE", "DELETE"],
  "expected_response": "RECEIPT",
  "ack_required": true,
  "observed_at": "2026-09-17T20:32:00Z",
  "expires_at": "2026-09-18T20:32:00Z",
  "idempotency_key": "exec-idem-001",
  "priority": 1,
  "effect_class": "REVERSIBLE_MUTATION",
  "status": null,
  "error": null,
  "receipt": null,
  "security_profile": "PRIVATE",
  "capabilities": ["intranel/1", "repo-write"],
  "provenance": ["repo:intranel", "authority:patrick"]
}
