{
  "protocol": "INTRANEL/1",
  "origin": "vera:primary",
  "actor": "radar:relay",
  "target": "vera:reviewer",
  "reply_to": "bus:vera-v2",
  "message_id": "vec-review-001",
  "operation_id": "review-op-001",
  "parent_message_id": "vec-query-001",
  "conversation_id": "vec-conv-001",
  "performative": "REVIEW",
  "subject": "repo:intranel/pr/1",
  "exact_subject": "sha1:0123456789abcdef0123456789abcdef01234567",
  "payload": {"mode": "HOSTILE", "scope": "INTRANEL/1"},
  "authority_claim_ref": null,
  "constraints": ["exact-subject-only"],
  "prohibited_effects": ["MERGE", "DEPLOY"],
  "expected_response": "REPORT",
  "ack_required": true,
  "observed_at": "2026-09-17T20:31:00Z",
  "expires_at": null,
  "idempotency_key": "review-idem-001",
  "priority": 1,
  "effect_class": "READ_ONLY",
  "status": null,
  "error": null,
  "receipt": null,
  "security_profile": "OPEN",
  "capabilities": ["intranel/1", "hostile-review"],
  "provenance": ["repo:intranel"]
}
