{
  "protocol": "INTRANEL/1",
  "origin": "vera:primary",
  "actor": "vera:primary",
  "target": "vera:lane/bv",
  "reply_to": "bus:vera-v2",
  "message_id": "vec-query-001",
  "operation_id": null,
  "target_operation_id": null,
  "parent_message_id": null,
  "conversation_id": "vec-conv-001",
  "performative": "QUERY",
  "subject": "repo:intranel",
  "exact_subject": null,
  "payload": {"query": "status"},
  "authority_claim_ref": null,
  "constraints": [],
  "prohibited_effects": ["MERGE"],
  "expected_response": "REPORT",
  "ack_required": false,
  "observed_at": "2026-09-17T20:30:00Z",
  "expires_at": null,
  "idempotency_key": null,
  "priority": 3,
  "effect_class": "READ_ONLY",
  "status": null,
  "error": null,
  "receipt": null,
  "security_profile": "OPEN",
  "capabilities": ["intranel/1"],
  "provenance": []
}
